Id used for finding text block,Contents of text block. Supports markdown formatting.
loc,text
intro,"I have made [visualizations viewed by hundreds of thousands of people](https://www.nytimes.com/interactive/2016/08/26/us/college-student-migration.html), [sped up query times for 25 terabytes of data by an average of 4,800 times](https://livefreeordichotomize.com/2019/06/04/using_awk_and_r_to_parse_25tb/), and built [packages for R](https://github.com/nstrayer/shinysense) that let you [do magic](http://nickstrayer.me/dataDayTexas/).

Currently searching for a position that allows me to build tools leveraging a combination of visualization, machine learning, and software engineering to help people explore and understand their data in new and useful ways."
industy_experience_aside,I have worked in a variety of roles ranging from journalist to software engineer to data scientist. I like collaborative environments where I can learn from my peers. 
teaching_experience_aside,I am passionate about education. I believe that no topic is too complex if the teacher is empathetic and willing to think about new methods of approaching task. 
data_science_writing_aside,I regularly blog about data science and visualization on my blog [LiveFreeOrDichotomize.](https://livefreeordichotomize.com/)